{"schema_version":"cognitive-runtime.projection-entry/v2","generation_id":"generation-aaaaaaaaaaaaaaaaaaaaaaaaaaaaaaaaaaaaaaaaaaaaaaaaaaaaaaaaaaaaaaaa","layer":"semantic","stable_id":"sem-synthetic","authority_version":"1","role":"semantic","checksum":"sha256:0000000000000000000000000000000000000000000000000000000000000000","source_refs":["src-synthetic-note"],"content":"Synthetic claim."}
